[
  {
    "question_id": "sat-math-probability-medium-q01",
    "exam_id": "sat",
    "exam_name": "SAT",
    "domain": "math",
    "section": "problem_solving_data",
    "skill": "probability",
    "lesson_id": "sat-math-probability-medium",
    "difficulty": "medium",
    "version": "1.0.0",
    "question_type": "multiple_choice",
    "subskill": "simple_probability",
    "prompt": "A bag contains 11 black, 3 green, and 3 blue beads. If one of the beads is selected at random, what is the probability that it is not green?",
    "choices": [
      {
        "id": "A",
        "text": "14/3",
        "rationale": "Keep the total in the denominator."
      },
      {
        "id": "B",
        "text": "3/14",
        "rationale": "Compare favourable to total, not to the rest."
      },
      {
        "id": "C",
        "text": "3/17",
        "rationale": "This is the probability of drawing green."
      },
      {
        "id": "D",
        "text": "14/17",
        "rationale": "Correct."
      }
    ],
    "correct_choice": "D",
    "explanation": "P(not green) = 1 − 3/17 = 14/17.",
    "estimated_time_seconds": 90,
    "tags": [
      "probability",
      "family:pb_single"
    ],
    "answer_verification": "P=14/17"
  },
  {
    "question_id": "sat-math-probability-medium-q02",
    "exam_id": "sat",
    "exam_name": "SAT",
    "domain": "math",
    "section": "problem_solving_data",
    "skill": "probability",
    "lesson_id": "sat-math-probability-medium",
    "difficulty": "medium",
    "version": "1.0.0",
    "question_type": "multiple_choice",
    "subskill": "simple_probability",
    "prompt": "Two events are independent. The probability that the first spinner lands on red is 1/6, and the probability that the second spinner lands on blue is 3/4. What is the probability that both events occur?",
    "choices": [
      {
        "id": "A",
        "text": "11/12",
        "rationale": "'Both' means multiply the probabilities, not add."
      },
      {
        "id": "B",
        "text": "2/5",
        "rationale": "Multiply numerators and denominators separately."
      },
      {
        "id": "C",
        "text": "1/8",
        "rationale": "Correct."
      },
      {
        "id": "D",
        "text": "19/24",
        "rationale": "That is P(at least one), not P(both)."
      }
    ],
    "correct_choice": "C",
    "explanation": "For independent events, P(both) = 1/6 × 3/4 = 1/8.",
    "estimated_time_seconds": 85,
    "tags": [
      "probability",
      "independent",
      "family:pb_compound"
    ],
    "answer_verification": "P=1/8"
  },
  {
    "question_id": "sat-math-probability-medium-q03",
    "exam_id": "sat",
    "exam_name": "SAT",
    "domain": "math",
    "section": "problem_solving_data",
    "skill": "probability",
    "lesson_id": "sat-math-probability-medium",
    "difficulty": "medium",
    "version": "1.0.0",
    "question_type": "multiple_choice",
    "subskill": "simple_probability",
    "prompt": "The probability that a randomly chosen part from a production line is defective is 3/8. If 160 parts are produced, how many are expected to be defective?",
    "choices": [
      {
        "id": "A",
        "text": "60",
        "rationale": "Correct."
      },
      {
        "id": "B",
        "text": "100",
        "rationale": "That is the expected number of good parts."
      },
      {
        "id": "C",
        "text": "140",
        "rationale": "Multiply 20 by the numerator 3."
      },
      {
        "id": "D",
        "text": "54",
        "rationale": "Multiply by the probability, not by its reciprocal."
      }
    ],
    "correct_choice": "A",
    "explanation": "3/8 × 160 = 60.",
    "estimated_time_seconds": 80,
    "tags": [
      "probability",
      "expected",
      "family:pb_expected"
    ],
    "answer_verification": "val=60"
  },
  {
    "question_id": "sat-math-probability-medium-q04",
    "exam_id": "sat",
    "exam_name": "SAT",
    "domain": "math",
    "section": "problem_solving_data",
    "skill": "probability",
    "lesson_id": "sat-math-probability-medium",
    "difficulty": "medium",
    "version": "1.0.0",
    "question_type": "data_interpretation",
    "subskill": "two_way_tables",
    "prompt": "The table summarizes 105 responses. If one response is selected at random, what is the probability that it is from the Adults group and in the Passed category?",
    "choices": [
      {
        "id": "A",
        "text": "35/73",
        "rationale": "This conditions on the column instead of the grand total."
      },
      {
        "id": "B",
        "text": "35/62",
        "rationale": "This conditions on the row instead of using the grand total."
      },
      {
        "id": "C",
        "text": "62/105",
        "rationale": "That is the whole row, not the single cell."
      },
      {
        "id": "D",
        "text": "1/3",
        "rationale": "Correct."
      }
    ],
    "correct_choice": "D",
    "explanation": "The single cell holds 35 of the 105 responses: 1/3.",
    "estimated_time_seconds": 90,
    "tags": [
      "probability",
      "table",
      "family:pb_table"
    ],
    "stimulus": {
      "type": "table",
      "table": {
        "caption": "Survey results",
        "headers": [
          "",
          "Passed",
          "Failed",
          "Total"
        ],
        "rows": [
          [
            "Adults",
            "35",
            "27",
            "62"
          ],
          [
            "Children",
            "38",
            "5",
            "43"
          ],
          [
            "Total",
            "73",
            "32",
            "105"
          ]
        ]
      }
    },
    "answer_verification": "P=1/3"
  },
  {
    "question_id": "sat-math-probability-medium-q05",
    "exam_id": "sat",
    "exam_name": "SAT",
    "domain": "math",
    "section": "problem_solving_data",
    "skill": "probability",
    "lesson_id": "sat-math-probability-medium",
    "difficulty": "medium",
    "version": "1.0.0",
    "question_type": "student_produced",
    "subskill": "simple_probability",
    "prompt": "A bag contains 12 black, 9 white, and 3 green tokens. If one of the tokens is chosen at random, what is the probability that it is not black?",
    "answer": {
      "type": "numeric",
      "value": 0.5,
      "accepted": [
        "1/2",
        "0.5"
      ],
      "tolerance": 0.0
    },
    "explanation": "1 − 12/24 = 1/2.",
    "estimated_time_seconds": 80,
    "tags": [
      "probability",
      "grid-in",
      "family:pb_gridin"
    ],
    "answer_verification": "val=1/2"
  },
  {
    "question_id": "sat-math-probability-medium-q06",
    "exam_id": "sat",
    "exam_name": "SAT",
    "domain": "math",
    "section": "problem_solving_data",
    "skill": "probability",
    "lesson_id": "sat-math-probability-medium",
    "difficulty": "medium",
    "version": "1.0.0",
    "question_type": "multiple_choice",
    "subskill": "simple_probability",
    "prompt": "A bag contains 8 green, 13 red, and 4 blue marbles. If one of the marbles is selected at random, what is the probability that it is not green?",
    "choices": [
      {
        "id": "A",
        "text": "8/17",
        "rationale": "Compare favourable to total, not to the rest."
      },
      {
        "id": "B",
        "text": "8/25",
        "rationale": "This is the probability of drawing green."
      },
      {
        "id": "C",
        "text": "17/8",
        "rationale": "Keep the total in the denominator."
      },
      {
        "id": "D",
        "text": "17/25",
        "rationale": "Correct."
      }
    ],
    "correct_choice": "D",
    "explanation": "P(not green) = 1 − 8/25 = 17/25.",
    "estimated_time_seconds": 90,
    "tags": [
      "probability",
      "family:pb_single"
    ],
    "answer_verification": "P=17/25"
  },
  {
    "question_id": "sat-math-probability-medium-q07",
    "exam_id": "sat",
    "exam_name": "SAT",
    "domain": "math",
    "section": "problem_solving_data",
    "skill": "probability",
    "lesson_id": "sat-math-probability-medium",
    "difficulty": "medium",
    "version": "1.0.0",
    "question_type": "multiple_choice",
    "subskill": "simple_probability",
    "prompt": "Two events are independent. The probability that the first machine passes inspection is 3/4, and the probability that the second machine passes inspection is 3/5. What is the probability that both events occur?",
    "choices": [
      {
        "id": "A",
        "text": "2/3",
        "rationale": "Multiply numerators and denominators separately."
      },
      {
        "id": "B",
        "text": "9/20",
        "rationale": "Correct."
      },
      {
        "id": "C",
        "text": "9/10",
        "rationale": "That is P(at least one), not P(both)."
      },
      {
        "id": "D",
        "text": "13/30",
        "rationale": "'Both' means multiply the probabilities, not add."
      }
    ],
    "correct_choice": "B",
    "explanation": "For independent events, P(both) = 3/4 × 3/5 = 9/20.",
    "estimated_time_seconds": 85,
    "tags": [
      "probability",
      "independent",
      "family:pb_compound"
    ],
    "answer_verification": "P=9/20"
  },
  {
    "question_id": "sat-math-probability-medium-q08",
    "exam_id": "sat",
    "exam_name": "SAT",
    "domain": "math",
    "section": "problem_solving_data",
    "skill": "probability",
    "lesson_id": "sat-math-probability-medium",
    "difficulty": "medium",
    "version": "1.0.0",
    "question_type": "multiple_choice",
    "subskill": "simple_probability",
    "prompt": "The probability that a randomly chosen part from a production line is defective is 2/5. If 80 parts are produced, how many are expected to be defective?",
    "choices": [
      {
        "id": "A",
        "text": "40",
        "rationale": "Multiply by the probability, not by its reciprocal."
      },
      {
        "id": "B",
        "text": "32",
        "rationale": "Correct."
      },